{
  "schemaVersion": "1.0.0",
  "id": "optics.opticalspace2",
  "name": "Optical Space",
  "nameFa": "محیط اپتیکی",
  "translationStatus": "verified-dictionary",
  "domain": "optics",
  "version": 1,
  "categories": [
    {
      "path": "Optics",
      "pathFa": "اپتیک"
    }
  ],
  "capabilities": [
    "ray-tracing"
  ],
  "ports": [],
  "properties": [
    {
      "key": "scale",
      "label": "Space units to meters ratio",
      "kind": "unknown",
      "role": "internal",
      "editable": false,
      "observable": false,
      "legacyType": null,
      "legacyFlags": [
        "readonly"
      ],
      "default": "1000.0"
    },
    {
      "key": "id-prefix",
      "label": "Id Prefix",
      "kind": "string",
      "role": "internal",
      "editable": false,
      "observable": false,
      "legacyType": "string",
      "legacyFlags": [
        "user-hidden"
      ]
    },
    {
      "key": "display-popup-pane-on-selection",
      "label": "Display Popup Pane On Selection",
      "kind": "boolean",
      "role": "internal",
      "editable": false,
      "observable": false,
      "legacyType": "bool",
      "legacyFlags": [
        "user-hidden"
      ],
      "default": true
    },
    {
      "key": "show-toolbar",
      "label": "Show Toolbar",
      "kind": "unknown",
      "role": "internal",
      "editable": false,
      "observable": false,
      "legacyType": null,
      "legacyFlags": [
        "user-hidden"
      ],
      "default": "true"
    },
    {
      "key": "opticalspace-color",
      "label": "Opticalspace Color",
      "kind": "unknown",
      "role": "observable",
      "editable": false,
      "observable": true,
      "legacyType": null,
      "legacyFlags": [
        "proxy"
      ],
      "default": "../p[@key=background-color]"
    },
    {
      "key": "background-color",
      "label": "Background Color",
      "kind": "unknown",
      "role": "rendering",
      "editable": false,
      "observable": false,
      "legacyType": null,
      "legacyFlags": [
        "user-hidden"
      ],
      "default": "black"
    },
    {
      "key": "orientation",
      "label": "Orientation",
      "kind": "unknown",
      "role": "state",
      "editable": false,
      "observable": false,
      "legacyType": null,
      "legacyFlags": [
        "user-hidden"
      ]
    },
    {
      "key": "orientation-constraint",
      "label": "Orientation Constraint",
      "kind": "string",
      "role": "internal",
      "editable": false,
      "observable": false,
      "legacyType": "string",
      "legacyFlags": [
        "user-hidden"
      ],
      "default": "fixed"
    },
    {
      "key": "size",
      "label": "Size",
      "kind": "vector2",
      "role": "internal",
      "editable": false,
      "observable": false,
      "legacyType": "point",
      "legacyFlags": [
        "user-hidden"
      ],
      "default": "(550.0, 400.0)",
      "legacyValidator": {
        "label": "",
        "values": [
          {
            "key": "",
            "type": "value-map",
            "value": "250, 200 850, 800"
          },
          {
            "key": "min",
            "type": "point",
            "value": "250, 200"
          },
          {
            "key": "max",
            "type": "point",
            "value": "850, 800"
          }
        ]
      }
    },
    {
      "key": "width",
      "label": "Width",
      "kind": "unknown",
      "role": "observable",
      "editable": false,
      "observable": true,
      "legacyType": null,
      "legacyFlags": [
        "writable-computed"
      ]
    },
    {
      "key": "height",
      "label": "Height",
      "kind": "unknown",
      "role": "observable",
      "editable": false,
      "observable": true,
      "legacyType": null,
      "legacyFlags": [
        "writable-computed"
      ]
    },
    {
      "key": "visible-size",
      "label": "Visible Size",
      "kind": "unknown",
      "role": "observable",
      "editable": false,
      "observable": true,
      "legacyType": null,
      "legacyFlags": [
        "writable-computed"
      ]
    },
    {
      "key": "resize-selection",
      "label": "Resize Selection",
      "kind": "boolean",
      "role": "internal",
      "editable": false,
      "observable": false,
      "legacyType": "bool",
      "legacyFlags": [
        "user-hidden"
      ],
      "default": true
    },
    {
      "key": "resize-origin",
      "label": "Resize Origin",
      "kind": "string",
      "role": "internal",
      "editable": false,
      "observable": false,
      "legacyType": "string",
      "legacyFlags": [
        "user-hidden"
      ],
      "default": "top-left"
    },
    {
      "key": "ray-segments",
      "label": "Ray Segments",
      "kind": "unknown",
      "role": "internal",
      "editable": false,
      "observable": false,
      "legacyType": "value-array",
      "legacyFlags": [
        "user-hidden",
        " computed"
      ]
    },
    {
      "key": "axis-images",
      "label": "Axis Images",
      "kind": "unknown",
      "role": "internal",
      "editable": false,
      "observable": false,
      "legacyType": "value-array",
      "legacyFlags": [
        "user-hidden",
        " computed"
      ]
    },
    {
      "key": "beam-segments",
      "label": "Beam Segments",
      "kind": "unknown",
      "role": "internal",
      "editable": false,
      "observable": false,
      "legacyType": "value-array",
      "legacyFlags": [
        "user-hidden",
        " computed"
      ]
    },
    {
      "key": "disable-context-menu",
      "label": "Disable Context Menu",
      "kind": "boolean",
      "role": "internal",
      "editable": false,
      "observable": false,
      "legacyType": "bool",
      "legacyFlags": [
        "user-hidden"
      ],
      "default": true
    },
    {
      "key": "marquee-stroke",
      "label": "Marquee Stroke",
      "kind": "color",
      "role": "internal",
      "editable": false,
      "observable": false,
      "legacyType": "color",
      "legacyFlags": [
        "user-hidden"
      ],
      "default": "#aaaaaa"
    },
    {
      "key": "arrangeable",
      "label": "Arrangeable",
      "kind": "boolean",
      "role": "internal",
      "editable": false,
      "observable": false,
      "legacyType": "bool",
      "legacyFlags": [
        "user-hidden"
      ],
      "default": false
    },
    {
      "key": "user-hidden",
      "label": "User Hidden",
      "kind": "boolean",
      "role": "observable",
      "editable": false,
      "observable": true,
      "legacyType": "bool",
      "legacyFlags": [
        "user-hidden"
      ],
      "default": true
    }
  ],
  "solver": {
    "engine": "optics-engine",
    "family": "ray-scene-component",
    "status": "contract-defined; implementation-pending",
    "inputs": [],
    "outputs": [
      "opticalspace-color",
      "width",
      "height",
      "visible-size",
      "user-hidden"
    ],
    "contractNotes": "Interface extracted from clean-room legacy research. Numerical equations must be independently specified and verified by golden tests."
  },
  "rendering": {
    "status": "implementation-pending",
    "legacyIconHint": "optics/icons/opticalSpace",
    "interaction": "drag/configure/observe"
  },
  "source": {
    "baseline": "Crocodile Physics 605 clean-room research dataset",
    "legacyClass": "optics/opticalSpace2",
    "legacyProto": "",
    "definitionFile": "optics.domain/parts/optics.xml",
    "inheritanceChain": [
      "optics/opticalSpace2"
    ],
    "paletteOccurrences": 1
  },
  "migration": {
    "dataModel": "generated",
    "solverImplementation": "pending",
    "visualImplementation": "pending",
    "scientificReview": "required",
    "evidenceLevel": "high"
  }
}