{
  "schemaVersion": "1.0.0",
  "id": "mechanics.chain",
  "name": "Chain",
  "nameFa": "زنجیر",
  "translationStatus": "verified-dictionary",
  "domain": "mechanics",
  "version": 1,
  "categories": [
    {
      "path": "Motion & Forces > Mechanisms",
      "pathFa": "حرکت و نیرو ← سازوکارها"
    }
  ],
  "capabilities": [
    "mechanical-coupling"
  ],
  "ports": [],
  "properties": [
    {
      "key": "splittable",
      "label": "Splittable",
      "kind": "unknown",
      "role": "internal",
      "editable": false,
      "observable": false,
      "legacyType": null,
      "legacyFlags": [],
      "default": "false"
    },
    {
      "key": "move-controller-config",
      "label": "Move Controller Config",
      "kind": "object",
      "role": "internal",
      "editable": false,
      "observable": false,
      "legacyType": "value-map",
      "legacyFlags": [
        "user-hidden"
      ],
      "default": "false | true"
    },
    {
      "key": "can-reflect",
      "label": "Can Reflect",
      "kind": "boolean",
      "role": "internal",
      "editable": false,
      "observable": false,
      "legacyType": "bool",
      "legacyFlags": [
        "user-hidden"
      ],
      "default": false
    },
    {
      "key": "orientation",
      "label": "Orientation",
      "kind": "unknown",
      "role": "state",
      "editable": false,
      "observable": false,
      "legacyType": null,
      "legacyFlags": [
        "user-hidden"
      ]
    },
    {
      "key": "motion-pos",
      "label": "Motion Pos",
      "kind": "vector2",
      "role": "computed",
      "editable": false,
      "observable": false,
      "legacyType": "point",
      "legacyFlags": [
        "computed",
        "user-hidden"
      ]
    },
    {
      "key": "ang",
      "label": "Ang",
      "kind": "number",
      "role": "internal",
      "editable": false,
      "observable": false,
      "legacyType": "double",
      "legacyFlags": [
        "user-hidden"
      ],
      "default": 0.0
    },
    {
      "key": "orientation-constraint",
      "label": "Orientation Constraint",
      "kind": "string",
      "role": "internal",
      "editable": false,
      "observable": false,
      "legacyType": "string",
      "legacyFlags": [
        "user-hidden"
      ],
      "default": "fixed"
    },
    {
      "key": "meta-label",
      "label": "Meta Label",
      "kind": "string",
      "role": "rendering",
      "editable": false,
      "observable": false,
      "legacyType": "string",
      "legacyFlags": [
        "user-hidden"
      ],
      "default": "Chain"
    },
    {
      "key": "meta-parttree-order",
      "label": "Meta Parttree Order",
      "kind": "integer",
      "role": "rendering",
      "editable": false,
      "observable": false,
      "legacyType": "int",
      "legacyFlags": [
        "user-hidden"
      ],
      "default": 100
    },
    {
      "key": "meta-icon",
      "label": "Meta Icon",
      "kind": "resource",
      "role": "rendering",
      "editable": false,
      "observable": false,
      "legacyType": "resource",
      "legacyFlags": [
        "user-hidden"
      ],
      "default": "motion/icons/chain"
    },
    {
      "key": "part-id-prefix",
      "label": "Part Id Prefix",
      "kind": "unknown",
      "role": "internal",
      "editable": false,
      "observable": false,
      "legacyType": null,
      "legacyFlags": []
    },
    {
      "key": "meta-controlpane",
      "label": "Meta Controlpane",
      "kind": "array",
      "role": "rendering",
      "editable": false,
      "observable": false,
      "legacyType": "string-array",
      "legacyFlags": [
        "user-hidden"
      ],
      "default": "motion/ui/chain"
    },
    {
      "key": "min-length",
      "label": "Min Length",
      "kind": "number",
      "role": "internal",
      "editable": false,
      "observable": false,
      "legacyType": "double",
      "legacyFlags": [
        "user-hidden"
      ],
      "quantity": "length",
      "default": 50.0
    },
    {
      "key": "pad-class",
      "label": "Pad Class",
      "kind": "unknown",
      "role": "internal",
      "editable": false,
      "observable": false,
      "legacyType": null,
      "legacyFlags": [],
      "default": "motion/chain-pad"
    },
    {
      "key": "bendable",
      "label": "Bendable",
      "kind": "unknown",
      "role": "internal",
      "editable": false,
      "observable": false,
      "legacyType": null,
      "legacyFlags": [],
      "default": "false"
    },
    {
      "key": "show-toolbar",
      "label": "Show Toolbar",
      "kind": "unknown",
      "role": "internal",
      "editable": false,
      "observable": false,
      "legacyType": null,
      "legacyFlags": [
        "user-hidden"
      ],
      "default": "true"
    },
    {
      "key": "toolbar-configuration",
      "label": "Toolbar Configuration",
      "kind": "object",
      "role": "internal",
      "editable": false,
      "observable": false,
      "legacyType": "value-map",
      "legacyFlags": [
        "user-hidden"
      ],
      "default": "top-right | user-front-facing motion/buttons/front-facing Front/side view View toggle"
    },
    {
      "key": "front-facing",
      "label": "Front Facing",
      "kind": "boolean",
      "role": "parameter",
      "editable": true,
      "observable": false,
      "legacyType": "bool",
      "legacyFlags": [
        "user-hidden"
      ],
      "default": true
    },
    {
      "key": "user-front-facing",
      "label": "Front view",
      "kind": "unknown",
      "role": "observable",
      "editable": false,
      "observable": true,
      "legacyType": null,
      "legacyFlags": [
        "proxy"
      ]
    },
    {
      "key": "start-gear-radius",
      "label": "Start Gear Radius",
      "kind": "number",
      "role": "computed",
      "editable": false,
      "observable": false,
      "legacyType": "double",
      "legacyFlags": [
        "computed",
        "user-hidden"
      ],
      "quantity": "length"
    },
    {
      "key": "end-gear-radius",
      "label": "End Gear Radius",
      "kind": "number",
      "role": "computed",
      "editable": false,
      "observable": false,
      "legacyType": "double",
      "legacyFlags": [
        "computed",
        "user-hidden"
      ],
      "quantity": "length"
    },
    {
      "key": "start-gear-ang",
      "label": "Start Gear Ang",
      "kind": "number",
      "role": "computed",
      "editable": false,
      "observable": false,
      "legacyType": "double",
      "legacyFlags": [
        "computed",
        "user-hidden"
      ]
    },
    {
      "key": "end-gear-ang",
      "label": "End Gear Ang",
      "kind": "number",
      "role": "computed",
      "editable": false,
      "observable": false,
      "legacyType": "double",
      "legacyFlags": [
        "computed",
        "user-hidden"
      ]
    },
    {
      "key": "start-gear-teeth",
      "label": "Start Gear Teeth",
      "kind": "integer",
      "role": "computed",
      "editable": false,
      "observable": false,
      "legacyType": "int",
      "legacyFlags": [
        "computed",
        "user-hidden"
      ]
    },
    {
      "key": "end-gear-teeth",
      "label": "End Gear Teeth",
      "kind": "integer",
      "role": "computed",
      "editable": false,
      "observable": false,
      "legacyType": "int",
      "legacyFlags": [
        "computed",
        "user-hidden"
      ]
    },
    {
      "key": "path",
      "label": "Path",
      "kind": "unknown",
      "role": "internal",
      "editable": false,
      "observable": false,
      "legacyType": null,
      "legacyFlags": [],
      "default": "(0,0),(100,100)"
    }
  ],
  "solver": {
    "engine": "mechanics-engine",
    "family": "mechanism",
    "status": "contract-defined; implementation-pending",
    "inputs": [
      "front-facing"
    ],
    "outputs": [
      "user-front-facing"
    ],
    "contractNotes": "Interface extracted from clean-room legacy research. Numerical equations must be independently specified and verified by golden tests."
  },
  "rendering": {
    "status": "implementation-pending",
    "legacyIconHint": "motion/icons/chain",
    "interaction": "drag/configure/observe"
  },
  "source": {
    "baseline": "Crocodile Physics 605 clean-room research dataset",
    "legacyClass": "motion/chain",
    "legacyProto": "motion/link-base",
    "definitionFile": "motion.domain/parts/30-mech.xml",
    "inheritanceChain": [
      "motion/chain",
      "motion/link-base"
    ],
    "paletteOccurrences": 1
  },
  "migration": {
    "dataModel": "generated",
    "solverImplementation": "pending",
    "visualImplementation": "pending",
    "scientificReview": "required",
    "evidenceLevel": "high"
  }
}